{
  "spec_version": "4.1",
  "naics": "541350",
  "title": "Building Inspection Services",
  "dataset_snapshot": {
    "path": "pipeline/datasets/v4_1/541350.json",
    "sha256": "b2878eed86987d64a2fa02d67dba63b2800d86ba5959bac3e04d85b464d5efba"
  },
  "target_archetype": {
    "selected_id": "residential-general-inspection",
    "alternatives": [
      {
        "id": "residential-general-inspection",
        "name": "Residential transaction and new-home inspection providers",
        "inclusion_criteria": [
          "Private firms classified in NAICS 541350 whose largest revenue family is general home inspection, new-home construction inspection, or combined home-and-pest inspection.",
          "The inspected property is primarily a house, condominium, townhome, or other dwelling, and the service ordinarily evaluates multiple building systems for a buyer, seller, owner, or builder.",
          "Firms may be independent, multi-inspector, enterprise, franchised, or multi-location; organizational form does not change the service-family classification.",
          "When two enumerated service families are tied for the largest revenue share, assign the firm to the lexicographically first stable archetype ID."
        ],
        "exclusion_criteria": [
          "Firms whose largest revenue family is commercial building inspection.",
          "Firms whose largest revenue family is a specific structural, electrical, roofing, HVAC, septic, exterior, moisture, recreational-facility, or other building-element inspection.",
          "Government establishments that conduct inspections and enforce building codes, pest-control firms, environmental consulting firms, real-estate appraisers, and construction-materials testing laboratories."
        ],
        "band_count": {
          "base": 18,
          "low": 8,
          "high": 23
        },
        "source_ids": [
          "A1",
          "A2",
          "A3",
          "A4"
        ],
        "rationale": "The 2022 Economic Census reports home inspection at 28.3%, new-home construction inspection at 11.7%, and combined home-and-pest inspection at 4.4% of NAICS 541350 receipts, totaling 44.4%. Applying that receipts share to the derived 40-firm band gives 17.76, rounded to 18. The range is deliberately wide because product receipts are establishment-level, firms may report more than one product, and the target band consists only of unusually large firms. The business-structure source confirms that residential inspection operators span solo, multi-inspector, and enterprise segments but does not measure the target band."
      },
      {
        "id": "commercial-general-inspection",
        "name": "Commercial general-building inspection providers",
        "inclusion_criteria": [
          "Private firms classified in NAICS 541350 whose largest revenue family is commercial building inspection.",
          "The service evaluates multiple systems or the overall physical condition of commercial, industrial, institutional, or multifamily property for owners, buyers, lenders, investors, or property managers.",
          "When two enumerated service families are tied for the largest revenue share, assign the firm to the lexicographically first stable archetype ID."
        ],
        "exclusion_criteria": [
          "Firms whose largest revenue family is residential general or new-home inspection.",
          "Firms whose largest revenue family is a specific building-element inspection.",
          "Engineering-design firms, environmental consultants, public building-code enforcement bodies, and construction-materials testing laboratories whose primary activity falls outside NAICS 541350."
        ],
        "band_count": {
          "base": 10,
          "low": 8,
          "high": 20
        },
        "source_ids": [
          "A1",
          "A2",
          "A3"
        ],
        "rationale": "Commercial building inspection represents 24.9% of 2022 NAICS 541350 receipts. Applying that share to 40 firms gives 9.96, rounded to 10. Its upper range is widened substantially because commercial providers may be disproportionately represented among firms with 100 or more employees, the only derived employment-size classes placed in the target band."
      },
      {
        "id": "specific-element-inspection",
        "name": "Specific building-element inspection providers",
        "inclusion_criteria": [
          "Private firms classified in NAICS 541350 whose largest revenue family is inspection of a specific structural, electrical, roofing, HVAC, septic, exterior, moisture, recreational-facility, or other building element.",
          "Inspection and condition reporting, rather than repair, engineering design, environmental consulting, pest control, or laboratory testing, is the primary activity.",
          "When two enumerated service families are tied for the largest revenue share, assign the firm to the lexicographically first stable archetype ID."
        ],
        "exclusion_criteria": [
          "Firms whose largest revenue family is residential general or new-home inspection.",
          "Firms whose largest revenue family is commercial general-building inspection.",
          "Environmental hazard detection, pest inspection, construction-materials testing, and government code-enforcement establishments."
        ],
        "band_count": {
          "base": 7,
          "low": 4,
          "high": 13
        },
        "source_ids": [
          "A1",
          "A2",
          "A3"
        ],
        "rationale": "Specific-element inspection represents 17.5% of 2022 NAICS 541350 receipts. Applying that share to 40 firms gives 7.0. The range allows for concentration in regulated specialties and for ambiguity between a multi-system commercial inspection and several element-specific inspections."
      }
    ],
    "residual": {
      "name": "Mixed, other-related, and unclassified inspection providers",
      "band_count": {
        "base": 5,
        "low": 2,
        "high": 10
      },
      "rationale": "Residual firms are those whose largest revenue family is other services related to building inspection or another non-enumerated product, plus firms whose product mix cannot be classified from available evidence. The base is the remainder after the three receipt-share-derived archetype counts: 40 minus 18 minus 10 minus 7 equals 5."
    },
    "enumeration_coverage": {
      "base": 0.875,
      "low": 0.8,
      "high": 0.95
    },
    "sources": [
      {
        "id": "A1",
        "url": "https://www.census.gov/naics/?details=541350&input=541350&year=2022",
        "title": "2022 NAICS Definition: 541350 Building Inspection Services",
        "vintage": "2022 definition, accessed 2026-07-21"
      },
      {
        "id": "A2",
        "url": "https://www2.census.gov/programs-surveys/economic-census/data/2022/API_Datasets/ECNNAPCSIND2022.zip",
        "title": "2022 Economic Census Selected Sectors: Industry by Products for the U.S. and States",
        "vintage": "2022 data, archive revised 2026-04-23"
      },
      {
        "id": "A3",
        "url": "https://bhs.econ.census.gov/ombpdfs2022/export/2022_PS-54135_su.pdf",
        "title": "2022 Economic Census Building Inspection Services Survey Instrument",
        "vintage": "2022 reporting year"
      },
      {
        "id": "A4",
        "url": "https://www.spectora.com/hubfs/Lead%20Magents/The%20State%20of%20Home%20Inspection%202025%20%281%29.pdf?hsLang=en",
        "title": "The State of Home Inspection 2025",
        "vintage": "2025 report using 2023-2024 operating data"
      }
    ],
    "selection_basis": "The derived dataset estimates 40 firms in the $1-10M EBITDA band. The 2022 Economic Census product-receipt shares are used as a disclosed population proxy to allocate those firms before any economic research: residential-related 44.4% x 40 = 17.76 (base 18), commercial general 24.9% x 40 = 9.96 (base 10), and specific-element 17.5% x 40 = 7.0 (base 7), leaving a base residual of 5. Residential general inspection has the largest base count and is selected. This is not a direct target-band firm census.",
    "selection_uncertainty": true
  },
  "value_basis": {
    "mode": "assumption",
    "scope": "Cash labor and independent-contractor cost structure of a target-band residential transaction and new-home inspection provider, allocated by mutually exclusive primary work function.",
    "bridge": null,
    "labor_contractor_cash_cost_share": {
      "base": 0.55,
      "range": {
        "low": 0.4,
        "high": 0.7
      },
      "evidence_state": "ASSUMPTION",
      "evidence_quality": "NONE",
      "source_ids": [],
      "rationale": "No contemporaneous target-archetype cost accounting was found. This frozen class-neutral range is a bounded structure for a field-service business with paid or contracted inspectors and centralized support; it is not an empirical estimate.",
      "caveats": [
        "The derived 541350 labor share and 5413 occupational mix are broader-industry measures and are not substituted for target-specific weights.",
        "Owner compensation, inspector classification, benefits, subcontracting, travel reimbursement, and franchise fees can materially change the cash-cost share.",
        "The range is intentionally broad and must not be narrowed without target-archetype evidence."
      ]
    },
    "roles": [
      {
        "role_id": "FIELD_INSPECTION",
        "title": "Onsite inspection and evidence capture",
        "role_cash_cost_weight": 0.55,
        "source_ids": [],
        "rationale": "Assumed largest cash-cost function: travel to properties, physical examination of structures and systems, measurements, photographs, and field notes."
      },
      {
        "role_id": "REPORT_PRODUCTION",
        "title": "Report drafting and delivery",
        "role_cash_cost_weight": 0.2,
        "source_ids": [],